{
  "name": "prototype-detail",
  "version": "0.0.1",
  "toolName": "prototypeApp",
  "basePath": "/companies/$companyId/tools/prototype",
  "views": ["detail", "edit", "itemEmails", "itemRelatedItems", "itemHistory"],
  "tabs": [
    { "title": "General", "view": "detail" },
    { "title": "Related Items", "view": "itemRelatedItems" },
    { "title": "Emails", "view": "itemEmails" },
    { "title": "Change History", "view": "itemHistory" }
  ]
}
